{
  "schema": "specnav.verification.transition-proposal.v1",
  "id": "transition-4f3ca10f9cc0981c27a38e84ea0c7ebaa14a89022614c408650e19b7754777d4",
  "failure_id": "failure-minimal",
  "change_id": "change-v2",
  "action": "close_failure",
  "owner": "core",
  "from_state": "closure_ready",
  "target_state": "closed",
  "case_ids": [
    "case-minimal"
  ],
  "attempt_ids": [
    "attempt-minimal"
  ],
  "reason_ids": [
    "required-regression-passed"
  ],
  "proposed_at": "2026-08-01T07:30:00Z"
}
